### ISSUE TITLE
Cloudstack VXLAN Usage Problem 

### ISSUE THREAD

**Issue by xuanyuanaosheng** [apache/cloudstack#7930]
##### ISSUE TYPE
 * Config / Usage problem

##### COMPONENT NAME
* Virtual routers

##### CLOUDSTACK VERSION
CloudStack 4.18.0.0

##### OS / ENVIRONMENT
OS:  oracle linux 8

##### CONFIGURATION
-  The cloudstack VXLAN is like:  https://users.cloudstack.apache.narkive.com/0IkEWVAi/information-on-vxlan-implementations-and-other-guest-isolation-methods
  
![image](https://github.com/apache/cloudstack/assets/4197714/597774a0-bf0c-41ea-8f1a-46be5f7533d3)

-  Advanced networking, using **VXLAN** (http:docs.cloudstack.apache.org/en/latest/plugins/vxlan.html?highlight=vxlan), having three blades.
   1.   _**kvm001**_  on blade enclosures BL12 
   2.   _**kvm002**_ on blade enclosures BL14
   3.   _**kvm003**_ on blade enclosures BL14

Our env is

![image](https://github.com/apache/cloudstack/assets/4197714/e245c997-2b4a-4b3a-80b5-d46f5d51ff50)

- The Guest Isolation method is using `VXLAN and the VLAN/VNI: 2800-2900`

![image](https://github.com/apache/cloudstack/assets/4197714/bcd6615c-6854-43fa-a6a1-718ed480d96b)

- The Public Network: VLAN: `2227  (10.71.227.0/24)`

- The management Network: `VLAN: 2128`

- The blade enclosures have enabled the following `VLANs: 2128, 2230, 2227`

- The switch has enabled the following `VLANs: 2128, 2230, 2227`

-  The hosts network config:
```
                 |---------------- cloudbr0:  10.26.128.22 ( VLAN 2128)
    kvm001 ------
                 |---------------- cloudbr1:  10.71.231.42 ( VLAN 2230)

                         
                 |---------------- cloudbr0:  10.26.128.23 ( VLAN 2128)
    kvm002 ------
                 |---------------- cloudbr1:  10.71.231.43 ( VLAN 2230)  
                 
                 
                 |---------------- cloudbr0:  10.26.128.25 ( VLAN 2128)
    kvm003 ------
                 |---------------- cloudbr1:  10.71.231.41 ( VLAN 2230)                   
                                      
```
The hosts can ping each other using cloudbr1.
The hosts can ping each other using cloudbr0.

The host network config, using kvm003 as en example:
```
# cat ifcfg-eno49
TYPE=Ethernet
BOOTPROTO=none
NAME=eno49
UUID=0650d63c-0244-4852-b0aa-ca5d8a64d8cb
DEVICE=eno49
ONBOOT=yes

# cat ifcfg-eno49.2128 
NAME=eno49.2128
DEVICE=eno49.2128
ONBOOT=yes
HOTPLUG=no
BOOTPROTO=none
VLAN=yes
BRIDGE=cloudbr0

# cat ifcfg-cloudbr0
NAME=cloudbr0
DEVICE=cloudbr0
TYPE=Bridge
BOOTPROTO=none
ONBOOT=yes
IPADDR=10.26.128.25
GATEWAY=10.26.128.254
NETMASK=255.255.255.0
HOTPLUG=no
DELAY=5
STP=no

-------------------------------------------------------------------------------------
# cat ifcfg-eno50
TYPE=Ethernet
BOOTPROTO=none
NAME=eno50
UUID=46da1a8f-615e-4649-be64-fc8e1c7dd264
DEVICE=eno50
ONBOOT=yes


# cat ifcfg-eno50.2230 
NAME=eno50.2230
DEVICE=eno50.2230
ONBOOT=yes
HOTPLUG=no
BOOTPROTO=none
VLAN=yes
BRIDGE=cloudbr1

# cat ifcfg-cloudbr1
NAME=cloudbr1
DEVICE=cloudbr1
TYPE=BRIDGE
ONBOOT=yes
BOOTPROTO=static
IPADDR=10.71.231.41
NETMASK=255.255.255.0
IPV6INIT=no
IPV6_AUTOCONF=no
HOTPLUG=no
DELAY=5
STP=no
```

The VPC is using `Default VPC offering`

![image](https://github.com/apache/cloudstack/assets/4197714/d1b32bc4-5697-4209-8ba5-816a1f0a2db3)

The VR r-30996-VM (10.71.227.33) is on kvm002, and the Virtual routers Health checks are all OK.

ubuntu221 (10.28.22.112) is on kvm001, set the mtu to 1400
ubuntu231 (10.28.22.19) is on kvm002, set the mtu to 1400
ubuntu251 (10.28.22.162) is on kvm003, set the mtu to 1400

The host VXLAN info using `vxlan2864` as an example:

```
# ip -d link show cloudbr0
7: cloudbr0: <BROADCAST,MULTICAST,UP,LOWER_UP> mtu 1500 qdisc noqueue state UP mode DEFAULT group default qlen 1000
    link/ether 20:67:7c:19:67:70 brd ff:ff:ff:ff:ff:ff promiscuity 0 minmtu 68 maxmtu 65535 
    bridge forward_delay 1500 hello_time 200 max_age 2000 ageing_time 30000 stp_state 0 priority 32768 vlan_filtering 0 vlan_protocol 802.1Q bridge_id 8000.20:67:7c:19:67:70 designated_root 8000.20:67:7c:19:67:70 root_port 0 root_path_cost 0 topology_change 0 topology_change_detected 0 hello_timer    0.00 tcn_timer    0.00 topology_change_timer    0.00 gc_timer   65.71 vlan_default_pvid 1 vlan_stats_enabled 0 vlan_stats_per_port 0 group_fwd_mask 0 group_address 01:80:c2:00:00:00 mcast_snooping 1 mcast_router 1 mcast_query_use_ifaddr 0 mcast_querier 0 mcast_hash_elasticity 16 mcast_hash_max 4096 mcast_last_member_count 2 mcast_startup_query_count 2 mcast_last_member_interval 100 mcast_membership_interval 26000 mcast_querier_interval 25500 mcast_query_interval 12500 mcast_query_response_interval 1000 mcast_startup_query_interval 3125 mcast_stats_enabled 0 mcast_igmp_version 2 mcast_mld_version 1 nf_call_iptables 0 nf_call_ip6tables 0 nf_call_arptables 0 addrgenmode eui64 numtxqueues 1 numrxqueues 1 gso_max_size 65536 gso_max_segs 65535

# ip -d link show cloudbr1
6: cloudbr1: <BROADCAST,MULTICAST,UP,LOWER_UP> mtu 1500 qdisc noqueue state UP mode DEFAULT group default qlen 1000
    link/ether 20:67:7c:19:67:78 brd ff:ff:ff:ff:ff:ff promiscuity 0 minmtu 68 maxmtu 65535 
    bridge forward_delay 1500 hello_time 200 max_age 2000 ageing_time 30000 stp_state 0 priority 32768 vlan_filtering 0 vlan_protocol 802.1Q bridge_id 8000.20:67:7c:19:67:78 designated_root 8000.20:67:7c:19:67:78 root_port 0 root_path_cost 0 topology_change 0 topology_change_detected 0 hello_timer    0.00 tcn_timer    0.00 topology_change_timer    0.00 gc_timer   60.14 vlan_default_pvid 1 vlan_stats_enabled 0 vlan_stats_per_port 0 group_fwd_mask 0 group_address 01:80:c2:00:00:00 mcast_snooping 1 mcast_router 1 mcast_query_use_ifaddr 0 mcast_querier 0 mcast_hash_elasticity 16 mcast_hash_max 4096 mcast_last_member_count 2 mcast_startup_query_count 2 mcast_last_member_interval 100 mcast_membership_interval 26000 mcast_querier_interval 25500 mcast_query_interval 12500 mcast_query_response_interval 1000 mcast_startup_query_interval 3125 mcast_stats_enabled 0 mcast_igmp_version 2 mcast_mld_version 1 nf_call_iptables 0 nf_call_ip6tables 0 nf_call_arptables 0 addrgenmode eui64 numtxqueues 1 numrxqueues 1 gso_max_size 65536 gso_max_segs 65535

# ip -d link show vxlan2864 
76: vxlan2864: <BROADCAST,MULTICAST,UP,LOWER_UP> mtu 1450 qdisc noqueue master brvx-2864 state UNKNOWN mode DEFAULT group default qlen 1000
    link/ether f6:01:07:83:28:a9 brd ff:ff:ff:ff:ff:ff promiscuity 1 minmtu 68 maxmtu 65535 
    vxlan id 2864 group 239.0.11.48 dev cloudbr1 srcport 0 0 dstport 8472 ttl 10 ageing 300 udpcsum noudp6zerocsumtx noudp6zerocsumrx 
    bridge_slave state forwarding priority 32 cost 100 hairpin off guard off root_block off fastleave off learning on flood on port_id 0x8001 port_no 0x1 designated_port 32769 designated_cost 0 designated_bridge 8000.f6:1:7:83:28:a9 designated_root 8000.f6:1:7:83:28:a9 hold_timer    0.00 message_age_timer    0.00 forward_delay_timer    0.00 topology_change_ack 0 config_pending 0 proxy_arp off proxy_arp_wifi off mcast_router 1 mcast_fast_leave off mcast_flood on bcast_flood on mcast_to_unicast off neigh_suppress off group_fwd_mask 0 group_fwd_mask_str 0x0 vlan_tunnel off isolated off addrgenmode eui64 numtxqueues 1 numrxqueues 1 gso_max_size 65536 gso_max_segs 65535
    
# ip -d link show brvx-2864
77: brvx-2864: <BROADCAST,MULTICAST,UP,LOWER_UP> mtu 1450 qdisc noqueue state UP mode DEFAULT group default qlen 1000
    link/ether f6:01:07:83:28:a9 brd ff:ff:ff:ff:ff:ff promiscuity 0 minmtu 68 maxmtu 65535 
    bridge forward_delay 1500 hello_time 200 max_age 2000 ageing_time 30000 stp_state 0 priority 32768 vlan_filtering 0 vlan_protocol 802.1Q bridge_id 8000.f6:1:7:83:28:a9 designated_root 8000.f6:1:7:83:28:a9 root_port 0 root_path_cost 0 topology_change 0 topology_change_detected 0 hello_timer    0.00 tcn_timer    0.00 topology_change_timer    0.00 gc_timer  200.93 vlan_default_pvid 1 vlan_stats_enabled 0 vlan_stats_per_port 0 group_fwd_mask 0 group_address 01:80:c2:00:00:00 mcast_snooping 1 mcast_router 1 mcast_query_use_ifaddr 0 mcast_querier 0 mcast_hash_elasticity 16 mcast_hash_max 4096 mcast_last_member_count 2 mcast_startup_query_count 2 mcast_last_member_interval 100 mcast_membership_interval 26000 mcast_querier_interval 25500 mcast_query_interval 12500 mcast_query_response_interval 1000 mcast_startup_query_interval 3125 mcast_stats_enabled 0 mcast_igmp_version 2 mcast_mld_version 1 nf_call_iptables 0 nf_call_ip6tables 0 nf_call_arptables 0 addrgenmode eui64 numtxqueues 1 numrxqueues 1 gso_max_size 65536 gso_max_segs 65535    
```
##### EXPECTED RESULTS
The VXLAN works fine.

##### ACTUAL RESULTS
The VXLAN can not work.  Now the vm on one blade enclosures can ping each other, But the vm on different blade enclosures can not ping each other. I use `arp command` and find:

![image](https://github.com/apache/cloudstack/assets/4197714/a292be7c-f0f0-41a3-a1a8-c1620bc8a331)

![image](https://github.com/apache/cloudstack/assets/4197714/aadeb81a-8fef-4ffc-87d3-b6f5a4356934)

I do not know why this happen, Could you please take a look and give some advices?

**Comment by xuanyuanaosheng** [comment]
@levindecaro  Thanks for your reply.  

I have followed your guidance and modified the network configuration to:
```
# cat ifcfg-eno1
TYPE=Ethernet
BOOTPROTO=none
NAME=eno1
UUID=a1420bd0-2cbe-45b4-b92e-7ba22aa148ef
DEVICE=eno1
ONBOOT=yes


# cat ifcfg-eno1.2128 
NAME=eno1.2128
DEVICE=eno1.2128
ONBOOT=yes
HOTPLUG=no
BOOTPROTO=none
VLAN=yes
BRIDGE=cloudbr0

# cat ifcfg-cloudbr0 
NAME=cloudbr0
DEVICE=cloudbr0
TYPE=BRIDGE
BOOTPROTO=none
ONBOOT=yes
IPADDR=10.26.128.22
GATEWAY=10.26.128.254
NETMASK=255.255.255.0
HOTPLUG=no
DELAY=5
STP=no

-------------------------------------------------------------------------------------
# cat ifcfg-eno2
TYPE=Ethernet
BOOTPROTO=none
NAME=eno2
UUID=d8d48df8-95f5-43af-afc5-433fc81f322e
DEVICE=eno2
ONBOOT=yes

# cat ifcfg-eno2.2230 
NAME=eno2.2230
DEVICE=eno2.2230
ONBOOT=yes
HOTPLUG=no
VLAN=yes
BOOTPROTO=static
IPADDR=10.71.231.42
NETMASK=255.255.255.0
```

Now the hosts network config:
```
                 |---------------- cloudbr0:  10.26.128.22 ( VLAN 2128)
    kvm001 ------
                 |---------------- eno2.2230:  10.71.231.42 ( VLAN 2230)

                         
                 |---------------- cloudbr0:  10.26.128.23 ( VLAN 2128)
    kvm002 ------
                 |---------------- eno2.2230:  10.71.231.43 ( VLAN 2230)  
                 
                 
                 |---------------- cloudbr0:  10.26.128.25 ( VLAN 2128)
    kvm003 ------
                 |---------------- eno2.2230:  10.71.231.41 ( VLAN 2230)                   
                                      
```

Now the guest vxlan network is binded to a vlan NIC: `eno2.2230` and the vlan interface should assigned a private IP  (10.71.231.42, 10.71.231.41, 10.71.231.43) to do multicast with peer host. and they can ping each other using  ` eno2.2230`.

The zone set is
![image](https://github.com/apache/cloudstack/assets/4197714/c690069e-2743-4491-99f0-c3b605422693)

The host can ping each other using `eno2.2230`:
```
[root@kvm001 ~]# ping -I eno2.2230 10.71.231.41
PING 10.71.231.41 (10.71.231.41) from 10.71.231.42 eno2.2230: 56(84) bytes of data.
64 bytes from 10.71.231.41: icmp_seq=1 ttl=64 time=0.161 ms
64 bytes from 10.71.231.41: icmp_seq=2 ttl=64 time=0.177 ms
64 bytes from 10.71.231.41: icmp_seq=3 ttl=64 time=0.178 ms
^C
--- 10.71.231.41 ping statistics ---
3 packets transmitted, 3 received, 0% packet loss, time 2027ms
rtt min/avg/max/mdev = 0.161/0.172/0.178/0.007 ms
[root@kvm001 ~]# ping -I eno2.2230 10.71.231.43
PING 10.71.231.43 (10.71.231.43) from 10.71.231.42 eno2.2230: 56(84) bytes of data.
64 bytes from 10.71.231.43: icmp_seq=1 ttl=64 time=0.239 ms
64 bytes from 10.71.231.43: icmp_seq=2 ttl=64 time=0.221 ms
^C
--- 10.71.231.43 ping statistics ---
2 packets transmitted, 2 received, 0% packet loss, time 1025ms
rtt min/avg/max/mdev = 0.221/0.230/0.239/0.009 ms
```

The hosts have configed:
```
Linux only configures enough IGMP memberships for 20 VXLAN networks.

Run this - echo 100 >/proc/sys/net/ipv4/igmp_max_memberships

And change permanent by adding this to  sysctl.conf -

net.ipv4.igmp_max_memberships = 100
```

The hosts have configed:
```
iptables -I INPUT -p udp -m udp --dport 8472 -j ACCEPT

iptables -A INPUT   -s 224.0.0.0/4 -j ACCEPT
iptables -A FORWARD -s 224.0.0.0/4 -d 224.0.0.0/4 -j ACCEPT
iptables -A OUTPUT  -d 224.0.0.0/4 -j ACCEPT

iptables-save > /etc/sysconfig/iptables
```
Now the host iptables on kvm002 
```
# cat /etc/sysconfig/iptables
# Generated by iptables-save v1.8.4 on Mon Sep  4 12:19:22 2023
*filter
:INPUT ACCEPT [296573:1195510000]
:FORWARD ACCEPT [0:0]
:OUTPUT ACCEPT [300735:351478871]
:LIBVIRT_INP - [0:0]
:LIBVIRT_OUT - [0:0]
:LIBVIRT_FWO - [0:0]
:LIBVIRT_FWI - [0:0]
:LIBVIRT_FWX - [0:0]
-A INPUT -p udp -m udp --dport 8472 -j ACCEPT
-A INPUT -p tcp -m tcp --dport 49152:49216 -j ACCEPT
-A INPUT -p tcp -m tcp --dport 5900:6100 -j ACCEPT
-A INPUT -j LIBVIRT_INP
-A INPUT -p tcp -m tcp --dport 16514 -j ACCEPT
-A INPUT -p tcp -m tcp --dport 16509 -j ACCEPT
-A INPUT -p tcp -m tcp --dport 22 -j ACCEPT
-A INPUT -s 224.0.0.0/4 -j ACCEPT
-A FORWARD -j LIBVIRT_FWX
-A FORWARD -j LIBVIRT_FWI
-A FORWARD -j LIBVIRT_FWO
-A FORWARD -s 224.0.0.0/4 -d 224.0.0.0/4 -j ACCEPT
-A OUTPUT -j LIBVIRT_OUT
-A OUTPUT -d 224.0.0.0/4 -j ACCEPT
COMMIT
# Completed on Mon Sep  4 12:19:22 2023
# Generated by iptables-save v1.8.4 on Mon Sep  4 12:19:22 2023
*security
:INPUT ACCEPT [368423:2248850292]
:FORWARD ACCEPT [0:0]
:OUTPUT ACCEPT [300741:351481031]
COMMIT
# Completed on Mon Sep  4 12:19:22 2023
# Generated by iptables-save v1.8.4 on Mon Sep  4 12:19:22 2023
*raw
:PREROUTING ACCEPT [371554:2249164792]
:OUTPUT ACCEPT [300741:351481031]
COMMIT
# Completed on Mon Sep  4 12:19:22 2023
# Generated by iptables-save v1.8.4 on Mon Sep  4 12:19:22 2023
*mangle
:PREROUTING ACCEPT [371554:2249164792]
:INPUT ACCEPT [368423:2248850292]
:FORWARD ACCEPT [0:0]
:OUTPUT ACCEPT [300741:351481031]
:POSTROUTING ACCEPT [300780:351485545]
COMMIT
# Completed on Mon Sep  4 12:19:22 2023
# Generated by iptables-save v1.8.4 on Mon Sep  4 12:19:22 2023
*nat
:PREROUTING ACCEPT [0:0]
:INPUT ACCEPT [0:0]
:POSTROUTING ACCEPT [0:0]
:OUTPUT ACCEPT [0:0]
COMMIT
# Completed on Mon Sep  4 12:19:22 2023


---------------------------------

# iptables -L
Chain INPUT (policy ACCEPT)
target     prot opt source               destination         
ACCEPT     udp  --  anywhere             anywhere             udp dpt:otv
ACCEPT     tcp  --  anywhere             anywhere             tcp dpts:49152:49216
ACCEPT     tcp  --  anywhere             anywhere             tcp dpts:rfb:synchronet-db
LIBVIRT_INP  all  --  anywhere             anywhere            
ACCEPT     tcp  --  anywhere             anywhere             tcp dpt:16514
ACCEPT     tcp  --  anywhere             anywhere             tcp dpt:16509
ACCEPT     tcp  --  anywhere             anywhere             tcp dpt:ssh
ACCEPT     all  --  base-address.mcast.net/4  anywhere            

Chain FORWARD (policy ACCEPT)
target     prot opt source               destination         
LIBVIRT_FWX  all  --  anywhere             anywhere            
LIBVIRT_FWI  all  --  anywhere             anywhere            
LIBVIRT_FWO  all  --  anywhere             anywhere            
ACCEPT     all  --  base-address.mcast.net/4  base-address.mcast.net/4 

Chain OUTPUT (policy ACCEPT)
target     prot opt source               destination         
LIBVIRT_OUT  all  --  anywhere             anywhere            
ACCEPT     all  --  anywhere             base-address.mcast.net/4 

Chain LIBVIRT_INP (1 references)
target     prot opt source               destination         

Chain LIBVIRT_OUT (1 references)
target     prot opt source               destination         

Chain LIBVIRT_FWO (1 references)
target     prot opt source               destination         

Chain LIBVIRT_FWI (1 references)
target     prot opt source               destination         

Chain LIBVIRT_FWX (1 references)
target     prot opt source               destination
```

According to the these configuration, the current situation is still the same as before.  

Any idears?

**Comment by levindecaro** [comment]
you seems missed 4789/udp

here is mine setting

```
        - 1798/tcp
        - 16509/tcp
        - 16514/tcp
        - 5900-6100/tcp
        - 49152-49216/tcp
        - 4789/udp
        - 8472/udp
```

**Comment by xuanyuanaosheng** [comment]
@levindecaro Thanks for your reply.

I have followed your guidance add iptables :
```
iptables -I INPUT -p udp -m udp --dport 4789 -j ACCEPT
iptables -I INPUT -p tcp -m tcp --dport 1798 -j ACCEPT
```

Now using `kvm001` as an example, the iptables is:
```
[root@kvm001 ~]# cat /etc/sysconfig/iptables
# Generated by iptables-save v1.8.4 on Mon Sep  4 12:19:22 2023
*filter
:INPUT ACCEPT [296573:1195510000]
:FORWARD ACCEPT [0:0]
:OUTPUT ACCEPT [300735:351478871]
:LIBVIRT_INP - [0:0]
:LIBVIRT_OUT - [0:0]
:LIBVIRT_FWO - [0:0]
:LIBVIRT_FWI - [0:0]
:LIBVIRT_FWX - [0:0]
-A INPUT -p udp -m udp --dport 8472 -j ACCEPT
-A INPUT -p udp -m udp --dport 4789 -j ACCEPT
-A INPUT -p tcp -m tcp --dport 49152:49216 -j ACCEPT
-A INPUT -p tcp -m tcp --dport 5900:6100 -j ACCEPT
-A INPUT -j LIBVIRT_INP
-A INPUT -p tcp -m tcp --dport 16514 -j ACCEPT
-A INPUT -p tcp -m tcp --dport 16509 -j ACCEPT
-A INPUT -p tcp -m tcp --dport 22 -j ACCEPT
-A INPUT -p tcp -m tcp --dport 1798 -j ACCEPT
-A INPUT -s 224.0.0.0/4 -j ACCEPT
-A FORWARD -j LIBVIRT_FWX
-A FORWARD -j LIBVIRT_FWI
-A FORWARD -j LIBVIRT_FWO
-A FORWARD -s 224.0.0.0/4 -d 224.0.0.0/4 -j ACCEPT
-A OUTPUT -j LIBVIRT_OUT
-A OUTPUT -d 224.0.0.0/4 -j ACCEPT
COMMIT
# Completed on Mon Sep  4 12:19:22 2023
# Generated by iptables-save v1.8.4 on Mon Sep  4 12:19:22 2023
*security
:INPUT ACCEPT [368423:2248850292]
:FORWARD ACCEPT [0:0]
:OUTPUT ACCEPT [300741:351481031]
COMMIT
# Completed on Mon Sep  4 12:19:22 2023
# Generated by iptables-save v1.8.4 on Mon Sep  4 12:19:22 2023
*raw
:PREROUTING ACCEPT [371554:2249164792]
:OUTPUT ACCEPT [300741:351481031]
COMMIT
# Completed on Mon Sep  4 12:19:22 2023
# Generated by iptables-save v1.8.4 on Mon Sep  4 12:19:22 2023
*mangle
:PREROUTING ACCEPT [371554:2249164792]
:INPUT ACCEPT [368423:2248850292]
:FORWARD ACCEPT [0:0]
:OUTPUT ACCEPT [300741:351481031]
:POSTROUTING ACCEPT [300780:351485545]
COMMIT
# Completed on Mon Sep  4 12:19:22 2023
# Generated by iptables-save v1.8.4 on Mon Sep  4 12:19:22 2023
*nat
:PREROUTING ACCEPT [0:0]
:INPUT ACCEPT [0:0]
:POSTROUTING ACCEPT [0:0]
:OUTPUT ACCEPT [0:0]
COMMIT
# Completed on Mon Sep  4 12:19:22 2023
```

But current situation is still the same as before.

-----

The network data stream:
```
kvm001 (eno2.2230, 10.71.231.42)   <=======>  kvm002 (eno2.2230, 10.71.231.43) 
```

The VM network data stream:
```
VM: ubuntu221  (10.28.22.112, i-2-30985-VM, 02:00:25:45:00:01)  --> vnet6 (fe:00:25:45:00:01) --> brvx-2841 (86:a4:a4:8b:23:91) --> vxlan2841 (vxlan://2841, mtu 1450, vxlan id 2841 group 239.0.11.25 dev eno2.2230 srcport 0 0 dstport 8472 ttl 10 ageing 300 udpcsum) --> eno2.2230 (20:67:7c:19:67:78) --> eno2  <---------------------------->   eno2 -->  eno2.2230 (ac:16:2d:ab:e3:e4) -->  vxlan2841 (vxlan://2841, mtu 1450, vxlan id 2841 group 239.0.11.25 dev eno2.2230 srcport 0 0 dstport 8472 ttl 10 ageing 300 udpcsum) --> brvx-2841 (36:ef:97:61:d5:c5) --> vnet8 (fe:00:5c:64:00:03) -->  VM: ubuntu231  (10.28.22.19, i-2-30986-VM, 02:00:5c:64:00:03)

The tcpdump result on kvm001 is:
```
# tcpdump -i vnet6  -s0  -nn -vvv 
dropped privs to tcpdump
tcpdump: listening on vnet6, link-type EN10MB (Ethernet), capture size 262144 bytes
15:55:54.266144 ARP, Ethernet (len 6), IPv4 (len 4), Request who-has 10.28.22.254 tell 10.28.22.112, length 28
15:55:55.319656 ARP, Ethernet (len 6), IPv4 (len 4), Request who-has 10.28.22.254 tell 10.28.22.112, length 28
15:55:56.343753 ARP, Ethernet (len 6), IPv4 (len 4), Request who-has 10.28.22.254 tell 10.28.22.112, length 28
15:56:04.266472 ARP, Ethernet (len 6), IPv4 (len 4), Request who-has 10.28.22.254 tell 10.28.22.112, length 28
15:56:05.303760 ARP, Ethernet (len 6), IPv4 (len 4), Request who-has 10.28.22.254 tell 10.28.22.112, length 28
15:56:06.327631 ARP, Ethernet (len 6), IPv4 (len 4), Request who-has 10.28.22.254 tell 10.28.22.112, length 28
^C
6 packets captured
6 packets received by filter
0 packets dropped by kernel

--------------------------------------------------------------------------------------------

# tcpdump -i brvx-2841  -s0  -nn -vvv 
dropped privs to tcpdump
tcpdump: listening on brvx-2841, link-type EN10MB (Ethernet), capture size 262144 bytes
15:56:24.266160 ARP, Ethernet (len 6), IPv4 (len 4), Request who-has 10.28.22.254 tell 10.28.22.112, length 28
15:56:25.271682 ARP, Ethernet (len 6), IPv4 (len 4), Request who-has 10.28.22.254 tell 10.28.22.112, length 28
15:56:26.295698 ARP, Ethernet (len 6), IPv4 (len 4), Request who-has 10.28.22.254 tell 10.28.22.112, length 28
15:56:34.266367 ARP, Ethernet (len 6), IPv4 (len 4), Request who-has 10.28.22.254 tell 10.28.22.112, length 28
15:56:35.319565 ARP, Ethernet (len 6), IPv4 (len 4), Request who-has 10.28.22.254 tell 10.28.22.112, length 28
15:56:36.343746 ARP, Ethernet (len 6), IPv4 (len 4), Request who-has 10.28.22.254 tell 10.28.22.112, length 28
15:56:44.266254 ARP, Ethernet (len 6), IPv4 (len 4), Request who-has 10.28.22.254 tell 10.28.22.112, length 28
15:56:45.303644 ARP, Ethernet (len 6), IPv4 (len 4), Request who-has 10.28.22.254 tell 10.28.22.112, length 28
15:56:46.327559 ARP, Ethernet (len 6), IPv4 (len 4), Request who-has 10.28.22.254 tell 10.28.22.112, length 28
15:56:54.266462 ARP, Ethernet (len 6), IPv4 (len 4), Request who-has 10.28.22.254 tell 10.28.22.112, length 28
15:56:55.287691 ARP, Ethernet (len 6), IPv4 (len 4), Request who-has 10.28.22.254 tell 10.28.22.112, length 28
15:56:56.311641 ARP, Ethernet (len 6), IPv4 (len 4), Request who-has 10.28.22.254 tell 10.28.22.112, length 28
^C
12 packets captured
12 packets received by filter
0 packets dropped by kernel


-----------------------------------------------------------------------------------------------

# tcpdump -i vxlan2841  -s0  -nn -vvv 
dropped privs to tcpdump
tcpdump: listening on vxlan2841, link-type EN10MB (Ethernet), capture size 262144 bytes
15:58:04.266350 ARP, Ethernet (len 6), IPv4 (len 4), Request who-has 10.28.22.254 tell 10.28.22.112, length 28
15:58:05.303652 ARP, Ethernet (len 6), IPv4 (len 4), Request who-has 10.28.22.254 tell 10.28.22.112, length 28
15:58:06.327539 ARP, Ethernet (len 6), IPv4 (len 4), Request who-has 10.28.22.254 tell 10.28.22.112, length 28
15:58:14.266350 ARP, Ethernet (len 6), IPv4 (len 4), Request who-has 10.28.22.254 tell 10.28.22.112, length 28
15:58:15.287671 ARP, Ethernet (len 6), IPv4 (len 4), Request who-has 10.28.22.254 tell 10.28.22.112, length 28
15:58:16.311607 ARP, Ethernet (len 6), IPv4 (len 4), Request who-has 10.28.22.254 tell 10.28.22.112, length 28
15:58:24.266230 ARP, Ethernet (len 6), IPv4 (len 4), Request who-has 10.28.22.254 tell 10.28.22.112, length 28
15:58:25.271531 ARP, Ethernet (len 6), IPv4 (len 4), Request who-has 10.28.22.254 tell 10.28.22.112, length 28
15:58:26.295662 ARP, Ethernet (len 6), IPv4 (len 4), Request who-has 10.28.22.254 tell 10.28.22.112, length 28
^C
9 packets captured
9 packets received by filter
0 packets dropped by kernel

-----------------------------------------------------------------------------------------------------

# tcpdump -i eno2.2230  -s0  -nn -vvv 
dropped privs to tcpdump
tcpdump: listening on eno2.2230, link-type EN10MB (Ethernet), capture size 262144 bytes
15:58:47.000764 IP (tos 0x0, ttl 10, id 50852, offset 0, flags [none], proto UDP (17), length 86)
    10.71.231.42.39295 > 239.0.10.246.8472: [bad udp cksum 0xd06d -> 0xfe83!] OTV, flags [I] (0x08), overlay 0, instance 2806
IP (tos 0x0, ttl 1, id 32142, offset 0, flags [DF], proto UDP (17), length 36)
    10.28.17.228.55670 > 225.0.0.50.3780: [bad udp cksum 0xfd53 -> 0x2b6a!] UDP, length 8
15:58:47.020424 IP (tos 0xc0, ttl 255, id 0, offset 0, flags [none], proto UDP (17), length 80)
    10.71.231.252.1985 > 224.0.0.102.1985: [udp sum ok] HSRPv1
15:58:47.104169 STP 802.1w, Rapid STP, Flags [Learn, Forward], bridge-id 18b6.00:de:fb:bb:23:41.8089, length 42
	message-age 0.00s, max-age 20.00s, hello-time 2.00s, forwarding-delay 15.00s
	root-id 18b6.00:de:fb:bb:23:41, root-pathcost 0, port-role Designated
15:58:47.239307 IP (tos 0x0, ttl 10, id 51088, offset 0, flags [none], proto UDP (17), length 114)
    10.71.231.42.34893 > 239.0.10.246.8472: [bad udp cksum 0xebd7 -> 0x7d25!] OTV, flags [I] (0x08), overlay 0, instance 2806
IP (tos 0xc0, ttl 255, id 18808, offset 0, flags [none], proto AH (51), length 64)
    10.28.17.228 > 224.0.0.18: AH(spi=0x0a1c11e4,sumlen=16,seq=0x14978): vrrp 10.28.17.228 > 224.0.0.18: VRRPv2, Advertisement, vrid 51, prio 100, authtype ah, intvl 1s, length 20, addrs: 10.28.17.254
15:58:47.803784 f4:03:43:00:c3:2d > 01:14:c2:44:1e:cc SNAP, oui Unknown (0x0014c2), pid Unknown (0x0001), length 58: 
	0x0000:  aaaa 0300 14c2 0001 0000 0000 0000 0000  ................
	0x0010:  0000 0000 0000 0000 0000 0000 0000 0000  ................
	0x0020:  0000 0000 0000 0000 0000 0000 0000 0000  ................
	0x0030:  0000 0000 0000 0000 0000 0000 0000 0000  ................
	0x0040:  0000                                     ..
15:58:48.000925 IP (tos 0x0, ttl 10, id 51614, offset 0, flags [none], proto UDP (17), length 86)
    10.71.231.42.39295 > 239.0.10.246.8472: [bad udp cksum 0xd06d -> 0xfe82!] OTV, flags [I] (0x08), overlay 0, instance 2806
IP (tos 0x0, ttl 1, id 32264, offset 0, flags [DF], proto UDP (17), length 36)
    10.28.17.228.55670 > 225.0.0.50.3780: [bad udp cksum 0xfd53 -> 0x2b69!] UDP, length 8
15:58:48.239568 IP (tos 0x0, ttl 10, id 51758, offset 0, flags [none], proto UDP (17), length 114)
    10.71.231.42.34893 > 239.0.10.246.8472: [bad udp cksum 0xebd7 -> 0x8f98!] OTV, flags [I] (0x08), overlay 0, instance 2806
IP (tos 0xc0, ttl 255, id 18809, offset 0, flags [none], proto AH (51), length 64)
    10.28.17.228 > 224.0.0.18: AH(spi=0x0a1c11e4,sumlen=16,seq=0x14979): vrrp 10.28.17.228 > 224.0.0.18: VRRPv2, Advertisement, vrid 51, prio 100, authtype ah, intvl 1s, length 20, addrs: 10.28.17.254
15:58:49.001019 IP (tos 0x0, ttl 10, id 52061, offset 0, flags [none], proto UDP (17), length 86)
    10.71.231.42.39295 > 239.0.10.246.8472: [bad udp cksum 0xd06d -> 0xfe81!] OTV, flags [I] (0x08), overlay 0, instance 2806
IP (tos 0x0, ttl 1, id 32503, offset 0, flags [DF], proto UDP (17), length 36)
    10.28.17.228.55670 > 225.0.0.50.3780: [bad udp cksum 0xfd53 -> 0x2b68!] UDP, length 8
15:58:49.031369 IP (tos 0xc0, ttl 255, id 0, offset 0, flags [none], proto UDP (17), length 80)
    10.71.231.253.1985 > 224.0.0.102.1985: [udp sum ok] HSRPv1
15:58:49.111227 STP 802.1w, Rapid STP, Flags [Learn, Forward], bridge-id 18b6.00:de:fb:bb:23:41.8089, length 42
	message-age 0.00s, max-age 20.00s, hello-time 2.00s, forwarding-delay 15.00s
	root-id 18b6.00:de:fb:bb:23:41, root-pathcost 0, port-role Designated
15:58:49.239808 IP (tos 0x0, ttl 10, id 52161, offset 0, flags [none], proto UDP (17), length 114)
    10.71.231.42.34893 > 239.0.10.246.8472: [bad udp cksum 0xebd7 -> 0xf7f0!] OTV, flags [I] (0x08), overlay 0, instance 2806
IP (tos 0xc0, ttl 255, id 18810, offset 0, flags [none], proto AH (51), length 64)
    10.28.17.228 > 224.0.0.18: AH(spi=0x0a1c11e4,sumlen=16,seq=0x1497a): vrrp 10.28.17.228 > 224.0.0.18: VRRPv2, Advertisement, vrid 51, prio 100, authtype ah, intvl 1s, length 20, addrs: 10.28.17.254
15:58:49.934281 IP (tos 0xc0, ttl 255, id 0, offset 0, flags [none], proto UDP (17), length 80)
    10.71.231.252.1985 > 224.0.0.102.1985: [udp sum ok] HSRPv1
15:58:50.001091 IP (tos 0x0, ttl 10, id 52180, offset 0, flags [none], proto UDP (17), length 86)
    10.71.231.42.39295 > 239.0.10.246.8472: [bad udp cksum 0xd06d -> 0xfe80!] OTV, flags [I] (0x08), overlay 0, instance 2806
IP (tos 0x0, ttl 1, id 32739, offset 0, flags [DF], proto UDP (17), length 36)
    10.28.17.228.55670 > 225.0.0.50.3780: [bad udp cksum 0xfd53 -> 0x2b67!] UDP, length 8
15:58:50.240065 IP (tos 0x0, ttl 10, id 52266, offset 0, flags [none], proto UDP (17), length 114)
    10.71.231.42.34893 > 239.0.10.246.8472: [bad udp cksum 0xebd7 -> 0xc4c7!] OTV, flags [I] (0x08), overlay 0, instance 2806
IP (tos 0xc0, ttl 255, id 18811, offset 0, flags [none], proto AH (51), length 64)
    10.28.17.228 > 224.0.0.18: AH(spi=0x0a1c11e4,sumlen=16,seq=0x1497b): vrrp 10.28.17.228 > 224.0.0.18: VRRPv2, Advertisement, vrid 51, prio 100, authtype ah, intvl 1s, length 20, addrs: 10.28.17.254
15:58:50.725440 IP (tos 0x0, ttl 10, id 52715, offset 0, flags [none], proto UDP (17), length 130)
    10.71.231.42.39295 > 239.0.10.246.8472: [bad udp cksum 0xd041 -> 0x0c23!] OTV, flags [I] (0x08), overlay 0, instance 2806
IP (tos 0x0, ttl 1, id 32762, offset 0, flags [DF], proto UDP (17), length 80)
    10.28.17.228.55670 > 225.0.0.50.3780: [bad udp cksum 0xfd7f -> 0x3961!] UDP, length 52
15:58:51.157149 STP 802.1w, Rapid STP, Flags [Learn, Forward], bridge-id 18b6.00:de:fb:bb:23:41.8089, length 42
	message-age 0.00s, max-age 20.00s, hello-time 2.00s, forwarding-delay 15.00s
	root-id 18b6.00:de:fb:bb:23:41, root-pathcost 0, port-role Designated
15:58:51.240308 IP (tos 0x0, ttl 10, id 53076, offset 0, flags [none], proto UDP (17), length 114)
    10.71.231.42.34893 > 239.0.10.246.8472: [bad udp cksum 0xebd7 -> 0xa036!] OTV, flags [I] (0x08), overlay 0, instance 2806
IP (tos 0xc0, ttl 255, id 18812, offset 0, flags [none], proto AH (51), length 64)
    10.28.17.228 > 224.0.0.18: AH(spi=0x0a1c11e4,sumlen=16,seq=0x1497c): vrrp 10.28.17.228 > 224.0.0.18: VRRPv2, Advertisement, vrid 51, prio 100, authtype ah, intvl 1s, length 20, addrs: 10.28.17.254
15:58:51.725634 IP (tos 0x0, ttl 10, id 53537, offset 0, flags [none], proto UDP (17), length 86)
    10.71.231.42.39295 > 239.0.10.246.8472: [bad udp cksum 0xd06d -> 0xfe7e!] OTV, flags [I] (0x08), overlay 0, instance 2806
IP (tos 0x0, ttl 1, id 32975, offset 0, flags [DF], proto UDP (17), length 36)
    10.28.17.228.55670 > 225.0.0.50.3780: [bad udp cksum 0xfd53 -> 0x2b65!] UDP, length 8
15:58:51.963509 IP (tos 0xc0, ttl 255, id 0, offset 0, flags [none], proto UDP (17), length 80)
    10.71.231.253.1985 > 224.0.0.102.1985: [udp sum ok] HSRPv1
15:58:52.240553 IP (tos 0x0, ttl 10, id 53582, offset 0, flags [none], proto UDP (17), length 114)
    10.71.231.42.34893 > 239.0.10.246.8472: [bad udp cksum 0xebd7 -> 0xc2b9!] OTV, flags [I] (0x08), overlay 0, instance 2806
IP (tos 0xc0, ttl 255, id 18813, offset 0, flags [none], proto AH (51), length 64)
    10.28.17.228 > 224.0.0.18: AH(spi=0x0a1c11e4,sumlen=16,seq=0x1497d): vrrp 10.28.17.228 > 224.0.0.18: VRRPv2, Advertisement, vrid 51, prio 100, authtype ah, intvl 1s, length 20, addrs: 10.28.17.254
15:58:52.725596 IP (tos 0x0, ttl 10, id 54044, offset 0, flags [none], proto UDP (17), length 86)
    10.71.231.42.39295 > 239.0.10.246.8472: [bad udp cksum 0xd06d -> 0xfe7d!] OTV, flags [I] (0x08), overlay 0, instance 2806
IP (tos 0x0, ttl 1, id 33041, offset 0, flags [DF], proto UDP (17), length 36)
    10.28.17.228.55670 > 225.0.0.50.3780: [bad udp cksum 0xfd53 -> 0x2b64!] UDP, length 8
15:58:52.803983 f4:03:43:00:c3:2d > 01:14:c2:44:1e:cc SNAP, oui Unknown (0x0014c2), pid Unknown (0x0001), length 58: 
	0x0000:  aaaa 0300 14c2 0001 0000 0000 0000 0000  ................
	0x0010:  0000 0000 0000 0000 0000 0000 0000 0000  ................
	0x0020:  0000 0000 0000 0000 0000 0000 0000 0000  ................
	0x0030:  0000 0000 0000 0000 0000 0000 0000 0000  ................
	0x0040:  0000                                     ..
15:58:52.863116 IP (tos 0xc0, ttl 255, id 0, offset 0, flags [none], proto UDP (17), length 80)
    10.71.231.252.1985 > 224.0.0.102.1985: [udp sum ok] HSRPv1
15:58:53.134722 STP 802.1w, Rapid STP, Flags [Learn, Forward], bridge-id 18b6.00:de:fb:bb:23:41.8089, length 42
	message-age 0.00s, max-age 20.00s, hello-time 2.00s, forwarding-delay 15.00s
	root-id 18b6.00:de:fb:bb:23:41, root-pathcost 0, port-role Designated
15:58:53.240808 IP (tos 0x0, ttl 10, id 54163, offset 0, flags [none], proto UDP (17), length 114)
    10.71.231.42.34893 > 239.0.10.246.8472: [bad udp cksum 0xebd7 -> 0x155a!] OTV, flags [I] (0x08), overlay 0, instance 2806
IP (tos 0xc0, ttl 255, id 18814, offset 0, flags [none], proto AH (51), length 64)
    10.28.17.228 > 224.0.0.18: AH(spi=0x0a1c11e4,sumlen=16,seq=0x1497e): vrrp 10.28.17.228 > 224.0.0.18: VRRPv2, Advertisement, vrid 51, prio 100, authtype ah, intvl 1s, length 20, addrs: 10.28.17.254
15:58:53.725750 IP (tos 0x0, ttl 10, id 54511, offset 0, flags [none], proto UDP (17), length 86)
    10.71.231.42.39295 > 239.0.10.246.8472: [bad udp cksum 0xd06d -> 0xfe7c!] OTV, flags [I] (0x08), overlay 0, instance 2806
IP (tos 0x0, ttl 1, id 33070, offset 0, flags [DF], proto UDP (17), length 36)
    10.28.17.228.55670 > 225.0.0.50.3780: [bad udp cksum 0xfd53 -> 0x2b63!] UDP, length 8
15:58:54.218217 IP (tos 0x0, ttl 10, id 10739, offset 0, flags [none], proto UDP (17), length 78)
    10.71.231.42.54808 > 239.0.11.6.8472: [bad udp cksum 0xebc3 -> 0xc614!] OTV, flags [I] (0x08), overlay 0, instance 2822
ARP, Ethernet (len 6), IPv4 (len 4), Request who-has 10.28.21.254 tell 10.28.21.136, length 28
15:58:54.241047 IP (tos 0x0, ttl 10, id 54529, offset 0, flags [none], proto UDP (17), length 114)
    10.71.231.42.34893 > 239.0.10.246.8472: [bad udp cksum 0xebd7 -> 0x8552!] OTV, flags [I] (0x08), overlay 0, instance 2806
IP (tos 0xc0, ttl 255, id 18815, offset 0, flags [none], proto AH (51), length 64)
    10.28.17.228 > 224.0.0.18: AH(spi=0x0a1c11e4,sumlen=16,seq=0x1497f): vrrp 10.28.17.228 > 224.0.0.18: VRRPv2, Advertisement, vrid 51, prio 100, authtype ah, intvl 1s, length 20, addrs: 10.28.17.254
15:58:54.266456 IP (tos 0x0, ttl 10, id 39369, offset 0, flags [none], proto UDP (17), length 78)
    10.71.231.42.54808 > 239.0.11.25.8472: [bad udp cksum 0xebd6 -> 0x5574!] OTV, flags [I] (0x08), overlay 0, instance 2841
ARP, Ethernet (len 6), IPv4 (len 4), Request who-has 10.28.22.254 tell 10.28.22.112, length 28
^C
29 packets captured
29 packets received by filter
0 packets dropped by kernel
```

@levindecaro  Please take a look, Thanks.

**Comment by levindecaro** [comment]
@xuanyuanaosheng , do you see any multicast packet on 10.71.231.43 eno2.2230 while 10.71.231.42.34893 > 239.0.10.246.8472 doing multicasting. If not, probably your switch is not forwarding multicast.

**Comment by GaryD0070** [comment]
just a thought - but VXLAN requires a minimum MTU of 1550

**Comment by xuanyuanaosheng** [comment]
@levindecaro Thanks for you reply.

This is indeed a multicast configuration, We close the igmp snooping  on the switches, and it works.

@GaryD0070  This is not a MTU problem.  We will change the MTU in future.

I will close this issue.

**Comment by xuanyuanaosheng** [comment]
Our network said： By default, Cisco only forwards multicast traffic in the 224.0.0.0/24 subnet.

**Comment by levindecaro** [comment]
@xuanyuanaosheng have a quick update,

> the guest vxlan network should bind to a vlan NIC eg: eth1.2000 or bond0.2000, not a bridge, and the vlan interface should assigned a private IP to do multicast with peer host.

I'm retested recent 4.18.1 release with OL9, the vxlan binding do not have problem with bridge interface now. just FYI
