### ISSUE TITLE
terracota.org HTTP 403

### ISSUE THREAD

**Issue by NuxRo** [apache/cloudstack#3493]
Hello,

Watching the logs after restarting 4.11.2 I can see the following error. It doesn't seem to break anything, but it'd be nice if someone confirmed what this does and how we can fix it.

```
2019-07-15 15:40:12,416 DEBUG [n.s.e.u.UpdateChecker] (net.sf.ehcache.CacheManager@b5d7233:null) (logid:) Update check failed: 
java.io.IOException: Server returned HTTP response code: 403 for URL: http://www.terracotta.org/kit/reflector?pageID=update.properties&kitID=ehcache.default&id=1833340124&os-name=Linux&jvm-name=OpenJDK+64-Bit+Server+VM&jvm-version=1.8.0_201&platform=amd64&tc-version=2.6.11&tc-product=Ehcache+Core+2.6.11&source=Ehcache+Core&uptime-secs=1&patch=UNKNOWN
	at sun.net.www.protocol.http.HttpURLConnection.getInputStream0(HttpURLConnection.java:1894)
	at sun.net.www.protocol.http.HttpURLConnection.getInputStream(HttpURLConnection.java:1492)
	at net.sf.ehcache.util.UpdateChecker.getUpdateProperties(UpdateChecker.java:108)
	at net.sf.ehcache.util.UpdateChecker.doCheck(UpdateChecker.java:72)
	at net.sf.ehcache.util.UpdateChecker.checkForUpdate(UpdateChecker.java:60)
	at net.sf.ehcache.util.UpdateChecker.run(UpdateChecker.java:51)
	at java.util.TimerThread.mainLoop(Timer.java:555)
	at java.util.TimerThread.run(Timer.java:505)
```

**Comment by server24** [comment]
I looked into my log for CS 4.11.2 running on CentOS 6 with RPMs provided by ShapeBlue and I do not see any such error message. Are you sure it is CS related?

**Comment by NuxRo** [comment]
Yes, I saw that in the management-server.log on my CentOS 7 server.

**Comment by server24** [comment]
OK, so probably you have the update feature and URL activated in ehcache.xml?

...
updateCheck="false"
...

Had such a file still in the /etc/cloud directory before everything was migrated to /etc/cloudstack and in the tomcatconf with the updateCheck enabled.

**Comment by NuxRo** [comment]
To be honest I have no idea, this is a new installation (4.11.2).

**Comment by server24** [comment]
Yes, please check if you have a file named:

/etc/cloudstack/management/ehcache.xml

on the CS management server and verify the content of that file, e.g. for "updatedCheck" and similar strings.

**Comment by NuxRo** [comment]
There is no such file in /etc/cloudstack. I grepped the whole thing for ehcache or terracota etc:

```
 grep -Ri ehcache /usr/share/cloudstack-management
Binary file /usr/share/cloudstack-management/lib/cloudstack-4.11.3.0.jar matches
grep -Ri updateCheck /usr/share/cloudstack-management
Binary file /usr/share/cloudstack-management/lib/cloudstack-4.11.3.0.jar matches

```

**Comment by server24** [comment]
OK, I have installed CS 4.11.2 and now also CS 4.11.3 on a fresh CentOS 7 installation using the RPMs from http://download.cloudstack.org/centos/7/ and the the RPMs from http://shapeblue.com/packages but was unable to get the 403 error code in the management-server logs.

But I am pretty sure it is related to some ehcache-configuration file or setting sitting somewhere in the system, maybe a custom built version with a different ehcache-failsafe.xml or ehcache.conf file in the relevant JAR?

**Comment by server24** [comment]
I found the specific message you are making reference to in the file:

net/sf/ehcache/util/UpdateChecker.class

included in the following JAR:
/usr/share/cloudstack-management/lib/cloudstack-4.11.3.0.jar

Sourcecode:
https://jar-download.com/artifacts/net.sf.ehcache/ehcache-core/2.6.11/source-code/net/sf/ehcache/util/UpdateChecker.java

Excerpt:
...
```
public class UpdateChecker extends TimerTask {
    private static final Logger LOG = LoggerFactory.getLogger(UpdateChecker.class.getName());
    private static final long MILLIS_PER_SECOND = 1000L;
    private static final int CONNECT_TIMEOUT = 3000;
    private static final String UNKNOWN = "UNKNOWN";
    private static final String UPDATE_CHECK_URL = "http://www.terracotta.org/kit/reflector?pageID=update.properties";
    private static final long START_TIME = System.currentTimeMillis();
```
...
```
    public void checkForUpdate() {
        try {
            if (!Boolean.getBoolean("net.sf.ehcache.skipUpdateCheck")) {
                doCheck();
            }
        } catch (Throwable t) {
            LOG.debug("Update check failed: ", t);
        }
```
...

I don't know why I do not see this in my logs, but the message stems from that class mentioned above, so we just have to figure out why it is shown in your logs/the update-call is being triggered.

**Comment by server24** [comment]
OK, I captured the network traffic on that newly installed CentOS 7 server and it actually is connecting to www.terracotta.org to check for updates. On this server that domain name resolves to 104.25.110.97 and this is the dump of the network packages:

```
16:48:44.556821 IP csmgm2.50460 > 104.25.110.97.http: Flags [S], seq 522085477, win 29200, options [mss 1460,sackOK,TS val 4981412 ecr 0,nop,wscale 7], length 0
16:48:44.557652 IP 104.25.110.97.http > csmgm2.50460: Flags [S.], seq 1391149656, ack 522085478, win 29200, options [mss 1460,nop,nop,sackOK,nop,wscale 10], length 0
16:48:44.557671 IP csmgm2.50460 > 104.25.110.97.http: Flags [.], ack 1, win 229, length 0
16:48:44.564469 IP csmgm2.50460 > 104.25.110.97.http: Flags [P.], seq 1:415, ack 1, win 229, length 414: HTTP: GET /kit/reflector?pageID=update.properties&kitID=ehcache.default&id=1411458529&os-name=Linux&jvm-name=OpenJDK+64-Bit+Server+VM&jvm-version=1.8.0_212&platform=amd64&tc-version=2.6.11&tc-product=Ehcache+Core+2.6.11&source=Ehcache+Core&uptime-secs=1&patch=UNKNOWN HTTP/1.1
16:48:44.565293 IP 104.25.110.97.http > csmgm2.50460: Flags [.], ack 415, win 30, length 0
16:48:44.569014 IP 104.25.110.97.http > csmgm2.50460: Flags [.], seq 1:1461, ack 415, win 30, length 1460: HTTP: HTTP/1.1 403 Forbidden
16:48:44.569051 IP 104.25.110.97.http > csmgm2.50460: Flags [P.], seq 1461:3566, ack 415, win 30, length 2105: HTTP
16:48:44.569090 IP 104.25.110.97.http > csmgm2.50460: Flags [P.], seq 3566:3571, ack 415, win 30, length 5: HTTP
16:48:44.574003 IP 104.25.110.97.http > csmgm2.50460: Flags [P.], seq 3566:3571, ack 415, win 30, length 5: HTTP
16:48:44.575403 IP csmgm2.50460 > 104.25.110.97.http: Flags [.], ack 1461, win 251, length 0
16:48:44.575419 IP csmgm2.50460 > 104.25.110.97.http: Flags [.], ack 3566, win 284, length 0
16:48:44.575430 IP csmgm2.50460 > 104.25.110.97.http: Flags [.], ack 3571, win 284, length 0
16:48:44.575441 IP csmgm2.50460 > 104.25.110.97.http: Flags [.], ack 3571, win 284, options [nop,nop,sack 1 {3566:3571}], length 0
16:48:45.834157 IP csmgm2.50460 > 104.25.110.97.http: Flags [F.], seq 415, ack 3571, win 284, length 0
16:48:45.835074 IP 104.25.110.97.http > csmgm2.50460: Flags [F.], seq 3571, ack 416, win 30, length 0
16:48:45.835085 IP csmgm2.50460 > 104.25.110.97.http: Flags [.], ack 3572, win 284, length 0
```

And I get back 403 forbidden, too - it just is not showing up in my log files. So maybe you just have a more verbose logging level set and everything is fine :-)

**Comment by rhtyd** [comment]
@NuxRo @server24 is this still an issue with 4.14 or latest master?

**Comment by DaanHoogland** [comment]
ping @NuxRo @server24 , is this still an issue?

**Comment by DaanHoogland** [comment]
closing, please re-open if you encounter this again
